{
  "schema": "openlunum-experiment/0.1",
  "id": "multilingual-parse-baselines-superqwen",
  "area": "multilingual-parse",
  "task": "parse",
  "hypothesis": "Establishing honest parse baselines for English, Greek, Spanish, and Indonesian using the SuperQwen AgentWorld 35B A3B model via local llama-server.",
  "baselineCommit": "6bb0bf6b1baf995f610d977e84b069996c8126b4",
  "dataset": {
    "path": "datasets/dev/multilingual-core-v1.jsonl",
    "sha256": "6a5dfd6eeea0c368218003a12a56221f61ad3119fc22aa431c4fd4cc99826873"
  },
  "modelProfile": "profiles/models/superqwen-agentworld-35b-live.json",
  "limits": {
    "maxItems": 16,
    "maxAttemptsPerItem": 1,
    "maxModelCalls": 16
  },
  "gates": {
    "minimumFeatureRecall": 0.95,
    "minimumExactRate": 0.75,
    "requireProtectedLiteralCoverage": true
  },
  "outputDirectory": "reports/experiments/multilingual-parse-baselines/superqwen-agentworld-35b-a3b"
}
